id,source,title,text,metadata
clapas_corynespora_111,CLAPAS-corynespora,Leaf spot of Hydrangea macrophylla caused by Corynespora cassiicola in China,"Leaf spot of Hydrangea macrophylla caused by Corynespora cassiicola in China Hydrangea macrophylla, also known as big leaf hydrangea, is an economically valuable ornamental garden plant. From 2016 to 2018, a high incidence of leaf spot disease of hydrangea occurred in Hunan Province of China. Symptoms consisted of irregular to circular lesions, dark brown in color with gray-white centers and delimited by dark brown borders. The lesions further coalesced to form irregularly shaped necrotic areas and extended to the leaf apex resulting in leaf wilt. A fungus was consistently isolated from the symptomatic plants and identified as Corynespora cassiicola by morphological characters and phylogenetic analyses. Pathogenicity was confirmed by fulfilling Koch's postulates. This is the first report of C. cassiicola causing leaf spot on H. macrophylla in China.","{""author_keywords"": ""Corynespora cassiicola; Hydrangea macrophylla; Koch's postulates; leaf spot disease; pathogenicity"", ""affiliations"": ""CAAS (Chinese Academy of Agricultural Sciences), Peoples R China ; Hunan Agr Univ, Peoples R China""}"
clapas_corynespora_112,CLAPAS-corynespora,First Report of Corynespora cassiicola Causing Leaf Spot on Kadsura coccinea in China,First Report of Corynespora cassiicola Causing Leaf Spot on Kadsura coccinea in China,"{""author_keywords"": """", ""affiliations"": ""CAAS (Chinese Academy of Agricultural Sciences), Peoples R China ; Hunan Agr Univ, Peoples R China""}"
clapas_corynespora_113,CLAPAS-corynespora,First Report of Leaf Spot Caused by Corynespora cassiicola on Ixeris polycephala in China,First Report of Leaf Spot Caused by Corynespora cassiicola on Ixeris polycephala in China,"{""author_keywords"": """", ""affiliations"": ""CAAS (Chinese Academy of Agricultural Sciences), Peoples R China ; Lanzhou Univ, Peoples R China""}"
clapas_corynespora_114,CLAPAS-corynespora,The green synthesis of carbon quantum dots and applications for sulcotrione detection and anti-pathogen activities,"The green synthesis of carbon quantum dots and applications for sulcotrione detection and anti-pathogen activities In this study, we synthesized simple, cheap, and stable nitrogen (N)-doped carbon quantum dots (N-CQDs) from Moringa oleifera roots. The N-CQDs exhibited an intense blue fluorescence and a quantum yield (QY) of up to 43.4%. When excited at 350 nm, the highest generated wavelength was observed at 445 nm. These N-CQDs were then successfully used to detect sulcotrione (limit of detection = 2 lg/mL); the method was reliable and exhibited good feasibility for measurements in real samples. When the N-CQDs concentration was 11.0 lL/mL, inhibitory rates against the pathogens, Corynespora cassiicola and Phytophtora nicotianae were 82.8% and 75.3%, respectively. To investigate N-CQDs safety for plant growth, different concentrations were investigated using sorghum seedlings, with N-CQDs exhibiting very low toxicity toward plant growth. Thus, these findings provide a basis for the development of N-CQDs as green pesticides. (c) 2021 The Author(s). Published by Elsevier B.V. on behalf of King Saud University. This is an open access article under the CC BY-NC-ND license (http://creativecommons.org/licenses/by-nc-nd/4.0/).","{""author_keywords"": ""Carbon quantum dots; Moringa oleifera roots; Sulcotrione; Inhibitory rates"", ""affiliations"": ""CAAS (Chinese Academy of Agricultural Sciences), Peoples R China ; Liaoning Univ Tradit Chinese Med, Peoples R China ; North Univ China, Peoples R China""}"
clapas_corynespora_115,CLAPAS-corynespora,Solvent- and Catalyst-free Synthesis and Antifungal Activities of α-Aminophosphonate Containing Cyclopropane Moiety,"Solvent- and Catalyst-free Synthesis and Antifungal Activities of α-Aminophosphonate Containing Cyclopropane Moiety Nine new alpha-aminophosphonate derivatives containing cyclopropane moiety have been synthesized via conventional and microwave irradiation methods under solvent- and catalyst-free condition. The structures of the title compounds have been confirmed by H-1 NMR, P-31 NMR, FTIR, EI-MS and FTICR-MS. Their antifungal activities were evaluated in vivo and some of the compounds were found to exhibit excellent antifungal activities against Corynespora cassiicola, Pseudomonas syringae pv. Lachrymans, Pseudoperonospora cubensis and Sclerotinia sclerotiorum.","{""author_keywords"": ""alpha-Aminophosphonate; Imine; Antifungal activity"", ""affiliations"": ""CAAS (Chinese Academy of Agricultural Sciences), Peoples R China ; Nankai Univ, Peoples R China""}"
clapas_corynespora_116,CLAPAS-corynespora,"Design, Synthesis, Antifungal Activities and 3D-QSAR of New N,N′-Diacylhydrazines Containing 2,4-Dichlorophenoxy Moiety","Design, Synthesis, Antifungal Activities and 3D-QSAR of New N,N′-Diacylhydrazines Containing 2,4-Dichlorophenoxy Moiety A series of new N,N-diacylhydrazine derivatives were designed and synthesized. Their structures were verified by H-1-NMR, mass spectra (MS) and elemental analysis. The antifungal activities of these N,N-diacylhydrazines were evaluated. The bioassay results showed that most of these N,N-diacylhydrazines showed excellent antifungal activities against Cladosporium cucumerinum, Corynespora cassiicola, Sclerotinia sclerotiorum, Erysiphe cichoracearum, and Colletotrichum orbiculare in vivo. The half maximal effective concentration (EC50) of one of the compounds was also determined, and found to be comparable with a commercial drug. To further investigate the structure-activity relationship, comparative molecular field analysis (CoMFA) was performed on the basis of antifungal activity data. Both the steric and electronic field distributions of CoMFA are in good agreement in this study.","{""author_keywords"": ""N; N-diacylhydrazines; antifungal activity; synthesis; three-dimensional quantitative structure-activity relationships (3D-QSAR)"", ""affiliations"": ""CAAS (Chinese Academy of Agricultural Sciences), Peoples R China ; Nankai Univ, Peoples R China ; Zhejiang Shuren Univ, Peoples R China ; Zhejiang Univ Technol, Peoples R China""}"
clapas_corynespora_117,CLAPAS-corynespora,"Synthesis and Antifungal Activity of Novel 1,2,4-Triazole Derivatives Containing 1,2,3-Thiadiazole Moiety","Synthesis and Antifungal Activity of Novel 1,2,4-Triazole Derivatives Containing 1,2,3-Thiadiazole Moiety Starting from carbonic acid diethyl ester, a series of 1,2,4-triazole derivatives containing 1,2,3-thiadiazole were synthesized. Reactions were performed by microwave irradiation or ultrasonic irradiation as well as by conventional heating. The structure of title compounds was characterized by H-1-NMR, MS, and elemental analyses. The fungicidal activities of these compounds were tested in vivo. Most of title compounds exhibited good antifungal activity against Pseudoperonospora cubensis. Some of title compounds displayed moderate antifungal activities against Fusarium oxysporum, Pseudoperonospora cubensis, Sphaerotheca fuligenea, Corynespora cassiicola, and Xanthomonas axonopodis.","{""author_keywords"": """", ""affiliations"": ""CAAS (Chinese Academy of Agricultural Sciences), Peoples R China ; Nankai Univ, Peoples R China ; Zhejiang Univ Technol, Peoples R China""}"
clapas_corynespora_118,CLAPAS-corynespora,Isolation and identification of 5-hydroxyl-5-methyl-2-hexenoic acid from Actinoplanes sp HBDN08 with antifungal activity,"Isolation and identification of 5-hydroxyl-5-methyl-2-hexenoic acid from Actinoplanes sp HBDN08 with antifungal activity A bioactivity-guided approach was employed to isolate and determine the chemical identity of bioactive constituents with antifungal activity from Actinoplanes sp. HBDN08. The structure of the antifungal metabolite was elucidated as 5-hydroxyl-5-methyl-2-hexenoic acid on the basis of spectral analysis. This compound showed strong in vitro antifungal activity against Botrytis cinerea, Cladosporium cucumerinum and Corynespora cassiicola, with an IC50 of 32.45, 27.17, and 30.66 mg/L, respectively; however, it only moderately inhibited hyphal growth of Rhizoctonia solani with an IC50 of 61.64 mg/L. The in vivo antifungal activity under greenhouse conditions demonstrated that 5-hydroxyl-5-methyl-2-hexenoic acid could effectively control the diseases caused by B. cinerea, C. cucumerinum and C. cassiicola with 71.42%, 78.63% and 65.13% control values at 350 mg/L, respectively. This strong antifungal activity suggests that 5-hydroxyl-5-methyl-2-hexenoic acid might be a promising candidate for new antifungal agents. (C) 2010 Elsevier Ltd. All rights reserved.","{""author_keywords"": ""Actinoplanes sp HBDN08; Antifungal activity; 5-Hydroxyl-5-methy1-2-hexenoic acid"", ""affiliations"": ""CAAS (Chinese Academy of Agricultural Sciences), Peoples R China ; NE Agr Univ, Peoples R China""}"
clapas_corynespora_119,CLAPAS-corynespora,Genome sequence and spore germination-associated transcriptome analysis ofCorynespora cassiicolafrom cucumber,"Genome sequence and spore germination-associated transcriptome analysis ofCorynespora cassiicolafrom cucumber Background Corynespora cassiicola, as a necrotrophic phytopathogenic ascomycetous fungus, can infect hundreds of species of plants and rarely causes human diseases. This pathogen infects cucumber species and causes cucumber target spot, which has recently caused large cucumber yield losses in China. Genome sequence and spore germination-associated transcriptome analysis will contribute to the understanding of the molecular mechanism of pathogenicity and spore germination ofC. cassiicola. Results First, we reported the draft genome sequences of the cucumber-sampledC. cassiicolaisolate HGCC with high virulence. Although conspecific, HGCC exhibited distinct genome sequence differences from a rubber tree-sampled isolate (CCP) and a human-sampled isolate (UM591). The proportion of secreted proteins was 7.2% in HGCC. A total of 28.9% (4232) of HGCC genes, 29.5% (4298) of CCP genes and 28.6% (4214) of UM591 genes were highly homologous to experimentally proven virulence-associated genes, respectively, which were not significantly different (P = 0.866) from the average (29.7%) of 10 other phytopathogenic fungi. Thousands of putative virulence-associated genes in various pathways or families were identified inC. cassiicola. Second, a global view of the transcriptome ofC. cassiicolaspores during germination was evaluated using RNA sequencing (RNA-Seq). A total of 3288 differentially expressed genes (DEGs) were identified. The majority of KEGG-annotated DEGs were involved in metabolism, genetic information processing, cellular processes, the organismal system, human diseases and environmental information processing. Conclusions These results facilitate the exploration of the molecular pathogenic mechanism ofC. cassiicolain cucumbers and the understanding of molecular and cellular processes during spore germination.","{""author_keywords"": ""Corynespora cassiicola; Cucumber; Genome sequence; Virulence-associated gene; Spore germination; RNA-Seq"", ""affiliations"": ""CAAS (Chinese Academy of Agricultural Sciences), Peoples R China ; Shanghai Runzhuang Agr Technol Co Ltd, Peoples R China""}"
clapas_corynespora_120,CLAPAS-corynespora,Sensitivity of Corynespora cassiicola to Carbendazim and Diethofencarb,"Sensitivity of Corynespora cassiicola to Carbendazim and Diethofencarb During 2005 and 2011, 159 isolates of Corynespora cassiicola were collected from 10 different provinces in China, and their sensitivities to carbendazim and diethofencarb were determined. Among all isolates, 8.2% were sensitive to carbendazim (M-s), 91.8% were highly resistant to carbendazim (M-HR) and 14.5% were highly resistant to both carbendazim and diethofencarb ((MNHR)-N-HR) moderately resistant isolates to carbendazim were not found. This is the first report of C. cassiicola isolates that were highly resistant to both carbendazim and diethofencarb. As compared to M-s isolates, M-HR and (MNHR)-N-HR isolates showed similar fitness in fungal growth rate, sporulation and pathogenicity. Carbendazim resistance correlated with a single mutation in beta-tubulin gene C. cassiicola amplified with primer pair beta-tubf1-F and beta-tubf1-R causing a change of glutamic to alanine at amino acid 198. Furthermore, the substitution of glutamic acid to lysine and phenylalanine to tyrosine led the resistance to both fungicides at amino acid 198 and 200 repecetively.","{""author_keywords"": ""Corynespora cassiicola; Carbendazim; Diethofencarb; beta-tubulin"", ""affiliations"": ""CAAS (Chinese Academy of Agricultural Sciences), Peoples R China ; Shenyang Agr Univ, Peoples R China""}"
clapas_corynespora_121,CLAPAS-corynespora,SnRK1 signaling regulates cucumber growth and resistance to Corynespora cassiicola,"SnRK1 signaling regulates cucumber growth and resistance to Corynespora cassiicola Energy metabolism is one of the key factors determining the growth and development of plants and the response to biotic and abiotic stresses. Sucrose non-fermentation 1 related protein kinase 1 (SnRK1) is an important energy-sensitive regulator that plays a key role in the overall control of carbohydrate metabolism. However, little is known about the function of SnRK1 in cucumber. In this study, metformin (an SnRK1 activator) and trehalose (an SnRK1 inhibitor) were used to investigate the role of SnRK1 signaling in cucumber. The results showed that SnRK1 activation could inhibit the growth of cucumber, slow down the net photosynthetic rate (Pn), reduce the contents of photosynthetic pigments and soluble sugars, and suppress the expression of genes related to sucrose metabolism. By contrast, SnRK1 inhibition yielded opposite results. Furthermore, SnRK1 activation and CsSnRK1 over-expression improved cucumber resistance to Corynespora cassiicola. While, SnRK1 inhibition and CsSnRK1 silencing reduced the resistance of cucumber to C. cassiicola. The results indicated that CsSnRK1 gene can positively regulate the resistance of cucumber to C. cassiicola. We conclude that CsSnRK1 signaling plays an important role in balancing the growth and immune response of cucumber. These results can be applied to the improvement of disease-resistant cucumber varieties.","{""author_keywords"": ""Cucumis sativus; CsSnRK1; Growth; Immune response"", ""affiliations"": ""CAAS (Chinese Academy of Agricultural Sciences), Peoples R China ; Shenyang Agr Univ, Peoples R China""}"
clapas_corynespora_122,CLAPAS-corynespora,"Novonestmycins A and B, two new 32-membered bioactive macrolides from Streptomyces phytohabitans HBERC-20821","Novonestmycins A and B, two new 32-membered bioactive macrolides from Streptomyces phytohabitans HBERC-20821 Two new 32- membered macrolide compounds, named Novonestmycins A ( 1) and B ( 2), were isolated from the soil strain Streptomyces phytohabitans HBERC-20821. Their structures were elucidated by using spectroscopic methods, including 1D, 2D-NMR and MS spectrometry. The two compounds showed strong activities against the phytophathogenic fungi Corynespora cassiicola, Rhizoctonia solani and Septoria nodorum, with MIC values of 0.78, 0.39 and 0.78 mu gml(-1), respectively. In addition, the two compounds exhibited potent inhibitory activities against four different human tumor cell lines as well as one 5- FU- resistant human hepatocellular carcinoma cell line, with IC50 of 0.15-0.48 mu g ml(-1) and 0.24-1.34 mu g ml(-1), respectively.","{""author_keywords"": """", ""affiliations"": ""CAAS (Chinese Academy of Agricultural Sciences), Peoples R China ; Syngenta, England ; Wuhan Univ, Peoples R China""}"
clapas_corynespora_123,CLAPAS-corynespora,"Synthesis and Fungicidal Activity of 1,2,4-Triazole Derivatives Containing 2-Fluorophenyl Moiety","Synthesis and Fungicidal Activity of 1,2,4-Triazole Derivatives Containing 2-Fluorophenyl Moiety A series of novel 1,2,4-triazole derivatives were synthesized from o-fluorobenzoic acid, hydrazine hydrate, phenyl isothiocyanate by multi-step reactions. Their structures were characterized by H-1 NMR, MS and elemental analyses. The target compounds were evaluated for their fungicidal activities against Corynespora cassiicola, Pseudomonas syringae pv. Lachrymans, Pseudoperonospora cubensis and Sclerotinia sclerotiorum in vivo, and the results indicated that some of the title compounds displayed excellent fungicidal activities.","{""author_keywords"": ""1,2,4-triazole; synthesis; fungicidal activity; o-fluorobenzoic acid"", ""affiliations"": ""CAAS (Chinese Academy of Agricultural Sciences), Peoples R China ; Zhejiang Shuren Univ, Peoples R China ; Zhejiang Univ Technol, Peoples R China""}"
clapas_corynespora_124,CLAPAS-corynespora,Corynespora cassiicola f. sp lantanae:: a potential biocontrol agent from Brazil for Lantana camara,"Corynespora cassiicola f. sp lantanae:: a potential biocontrol agent from Brazil for Lantana camara Corynespora cassiicola was found for the first time in Brazil in association with Lantana camara. The fungus caused severe defoliation of plants under field conditions. A host-range test indicated that this particular isolate is highly specific to L. carnara and restricted to certain lantana biotypes. The lantana-pathogenic C. cassiicola was recognized as a new forma specialis and named C. cassiicola f. sp. lantanae. The fungus sporulated abundantly in some solid substrates, particularly rice and sorghum grains and ground cassava roots. It sporulated well in vegetable-broth-agar medium when grown under continuous light for 15 days at an optimal temperature of 23 degreesC. Inoculated L. camara plants developed 100% disease severity and > 70% defoliation when exposed to a minimum of 6-h dew period following inoculation. Even plants not exposed to dew developed a high level of disease severity 6 h after inoculation. Plants inoculated twice at 15-day intervals developed high levels of disease severity, had significant growth-reduction, and occasionally died. A phytotoxic substance was present in the filtrate from germinated conidia of the fungus. C cassiicola f. sp. lantanae appears to have a high potential as a biocontrol agent for certain L. camara biotypes. (C) 2002 Elsevier Science (USA). All rights reserved.","{""author_keywords"": ""biological weed control; Lantana camara; lantana; Corynespora cassiicola"", ""affiliations"": ""CAB-International (Commonwealth Agricultural Bureau International), England ; Univ Fed Vicosa, Brazil""}"
clapas_corynespora_125,CLAPAS-corynespora,Notes on Vamsapriya and V-camagueyensis comb. nov.,"Notes on Vamsapriya and V-camagueyensis comb. nov. A new combination, Vamsapriya camagueyensis, is proposed to accommodate Corynespora camagueyensis based on the type of conidial septa. Vamsapriya camagueyensis is distinguished by blastocatenate, cylindrical, 6-9-euseptate, brown to reddish-brown conidia. A key to Vamsapriya species is provided.","{""author_keywords"": ""asexual fungi; systematics; tropical fungi"", ""affiliations"": ""CAES (Connecticut Agricultural Experiment Station), USA ; CIBE (Centro de Investigaciones Biotecnologicas del Ecuador), Ecuador ; INIFAT (Instituto de Investigaciones Fundamentales en Agricultura Tropical Alejandro de Humboldt), Cuba ; Nanjing Forestry Univ, Peoples R China ; Shandong Agr Univ, Peoples R China ; Univ Estadual Feira de Santana, Brazil ; Univ Estatal Milagro UNEMI, Ecuador""}"
clapas_corynespora_126,CLAPAS-corynespora,Morganjonesia gen. nov. for two atypical Corynespora and Teratosperma species,"Morganjonesia gen. nov. for two atypical Corynespora and Teratosperma species Morganjonesia is proposed as a new genus for two species, Corynespora calophylli and Teratosperma litchii, which have monotretic conidial ontogeny on the terminal conidiogenous cells and solitary, euseptate, verruculose, brown conidia with a single, subulate or acute, hyaline conidial appendage at the apex (sometimes with another downwardly-direct conidial appendage). Illustrations of both species are provided.","{""author_keywords"": ""asexual Ascomycota; hyphomycetes; systematics"", ""affiliations"": ""CAES (Connecticut Agricultural Experiment Station), USA ; INIFAT (Instituto de Investigaciones Fundamentales en Agricultura Tropical Alejandro de Humboldt), Cuba ; Nanjing Forestry Univ, Peoples R China ; Shandong Yingcai Univ, Peoples R China ; Yunnan Univ, Peoples R China""}"
clapas_corynespora_127,CLAPAS-corynespora,Evaluation of Hydrangea macrophylla for Resistance to Leaf-Spot Diseases,"Evaluation of Hydrangea macrophylla for Resistance to Leaf-Spot Diseases Garden hydrangea (Hydrangea macrophylla) is a popular ornamental plant that can be devastated by leaf-spot diseases. Information is needed to determine susceptibility of commercial cultivars to leaf-spot diseases. To address this need, 88 cultivars of H.macrophylla were evaluated for their resistance to leaf-spot diseases in full-shade (20072008), full-sun (20072008) and partial-shade (20092010) environments in McMinnville, TN, USA. Ten cultivars [Ami Pasquier, Ayesha, Blue Bird, Forever Pink, Fuji Waterfall (Fujinotaki), Miyama-yae-Murasaki, Seafoam, Taube, Tricolor and Veitchii] were rated resistant (R) or moderately resistant to leaf spot under each of the three environments. In 20072008, approximately 51% of the cultivars were rated R in full shade, but only 5% were R in full sun. In 20092010, only 1% of the cultivars were rated R in partial shade. Although environmental parameters including temperature and rainfall influence disease severity and host reaction, a shaded environment was least favourable for leaf-spot disease development, which demonstrates that establishing hydrangea in shaded environment can be an effective tool along with cultivar selection for managing leaf-spot diseases on hydrangea. Six pathogens, Corynespora cassiicola, Cercospora spp., Myrothecium roridum, Glomerella cingulata (Anamorph: Colletotrichum gloeosporioides), Phoma exigua and Botrytis cinerea, were associated with leaf-spot diseases of garden hydrangea. Of the leaf-spot pathogens, C.cassiicola was most frequently isolated (55% of all isolates), followed by Cercospora spp. (20%) and other pathogens (25%). Because symptoms attributed to each leaf-spot pathogen were similar, cultivars were selected for resistance to multiple leaf-spot pathogens.","{""author_keywords"": ""Corynespora cassiicola; Cercospora spp; Glomerella cingulata; Colletotrichum gloeosporioides; Phoma exigua; Myrothecium roridum; Botrytis cinerea; Hydrangea macrophylla; resistance selections"", ""affiliations"": ""CAES (Connecticut Agricultural Experiment Station), USA ; Kookmin Univ, South Korea ; Tennessee State Univ, USA""}"
clapas_corynespora_128,CLAPAS-corynespora,Diversity of saprobic fungi on Magnoliaceae,"Diversity of saprobic fungi on Magnoliaceae The diversity of fungi found on woody litter of three genera of plants in the family Magnoliaceae is reported and the communities are compared. Saprobic fungi were investigated from 150 samples of decaying woody litter of Magnolia liliifera, Manglietia garrettii and Michelia baillonii. Two-hundred and thirty-nine fungi were identified comprising 92 ascomycetes, 4 basidiomycetes and 143 anamorphic fungi. Corynespora cassiicola (60% frequency of occurence) was the most common taxon found on Magnolia liliifera samples. Ellisembia opaca and Phaeoisaria clematidis with 27.5% frequency of occurence were the dominant species from Manglietia garrettii, while Annellophora phoenicis and Ellisembia adscendens (18%) were the most commonly encountered species from Michelia baillonii. Distinct fungal communities were found on samples of the three tree species. In terms of the numbers of taxa recovered, fungi were more diverse on Michelia baillonii than on the other two genera, although the common genera of fungi obtained from woody litter of each host were similiar. Seasonal effect on the fungal communities was investigated. Dry season samples supported a significantly more diverse fungal community than samples from the wet season. Relatively few species of woody fungi recorded in this study had been previously recorded from wood samples by other researchers.","{""author_keywords"": ""lignicolous fungi; Magnolia; Manglietia; Michelia; Magnoliaceae; saprobe"", ""affiliations"": ""CAF (Chinese Academy of Forestry), Peoples R China ; Chiang Mai Univ, Thailand ; Mae Fah Luang Univ, Thailand ; Manaaki Whenua Landcare Research, New Zealand ; Pibulsongkram Rajabhat Univ, Thailand""}"
