id,source,title,text,metadata
clapas_corynespora_392,CLAPAS-corynespora,"An exhaustive genome analysis of a virulent Indian isolate of Corynespora cassiicola, causal agent of Corynespora leaf fall (CLF) disease in Hevea brasiliensis","An exhaustive genome analysis of a virulent Indian isolate of Corynespora cassiicola, causal agent of Corynespora leaf fall (CLF) disease in Hevea brasiliensis Corynespora cassiicola is an anamorphic pathogenic fungus belonging to the phylum Ascomycota with a broad host range. It causes the Corynespora leaf fall (CLF) disease, in rubber trees for which it badly affects natural rubber production. A small phytotoxic protein named cassiicolin derived from the cassiicolin gene (Cas gene) of the fungus was thought to be inducing the pathogenicity in rubber tree; however, some of the isolates that do not possess cassiicolin gene shows aggressiveness on the host. The present study intends to identify the effect of cassiicolin and other putative effectors involved in CLF disease. Comparative screening of the crude toxin extracted from 30 isolates was carried out for cassiicolin activity and the Cas isoform was determined. The isolate named HV showed maximum aggressiveness and the presence of a Cas gene isoform (Cas2). It was sequenced, assembled, and confirmed for the presence of Cas2 isoform of the Cassiicolin gene. This is the first report of an Indian isolate having a Cas-2 isoform from Hevea brasiliensis. The phylogenetic analysis reveals the similarity of Cas gene from HV to Cas2 gene of CC004 strain of China. The effector proteins present in the isolate (HV) were identified. A total of 1035 effector proteins were predicted, among them 1026 were matched with the DFVF database, and in which 229 are classified as leaf spot-associated virulence factors. The predicted gene and proteins were mostly associated with carbohydrate and amino acid metabolism. Identification of specific effectors involved in the pathogenicity helps to step towards the understanding of C. cassiicola virulence and host-pathogen interaction. The data of this work and its future aspects will furnish the facts behind the interaction between the Hevea and Corynespora.","{""author_keywords"": ""Genome; Plant-pathogen interaction; Cassiicolin; Putative effectors; Virulence; Cas gene"", ""affiliations"": ""RRII (Rubber Research Institute of India), India""}"
clapas_corynespora_393,CLAPAS-corynespora,Transcriptome profiling reveals genetic basis of disease resistance against Corynespora cassiicola in rubber tree (Hevea brasiliensis),"Transcriptome profiling reveals genetic basis of disease resistance against Corynespora cassiicola in rubber tree (Hevea brasiliensis) Corynespora leaf disease caused by Corynespora cassiicola (Berk. & Curt.) is one of the major diseases responsible for significant yield loss in rubber trees (Hevea brasiliensis). Next-generation sequencing based transcriptomic study of two rubber clones: RRII 105 (susceptible) and GT 1 (moderately resistant) were performed to understand the molecular basis of host tolerance to fungal diseases. Genes encoding disease resistance proteins, leucine-rich repeat proteins and genes involved in carbohydrate metabolic processes were significantly up-regulated in GT 1 upon infection, but were either completely suppressed or down-regulated in RRII 105. Transcription factor activity was a major molecular function triggered in both inoculated clones. Gene Ontology analysis revealed that majority of the transcripts was enriched for defense response, response to stimulus and stress. Higher expression of 118 transcripts with complete ORFs was identified in inoculated GT 1, indicating their possible role in disease resistance. In addition, both unique and common simple sequence repeats (SSRs) were identified. In silico analysis revealed 191 informative SSRs differentiating the two clones. Variant calling in control and disease GT 1 transcriptomes with reference to RRII 105 revealed over one lakh putative base substitutions. Microarray was used to validate the results obtained on transcriptional responses. Biotic stress overview from MapMan analysis revealed stronger activation of defense-related genes, receptor-like kinases and transcription factors. This study presents the first comprehensive transcriptome of resistant and susceptible rubber clones in response to C. cassiicola. The newly identified differentially regulated genes and sequence variation provide critical knowledge for understanding the genetic basis of disease resistance and marker development.","{""author_keywords"": ""Corynespora leaf disease; Rubber tree; RNA-Seq analysis; Digital gene expression; Disease resistance proteins"", ""affiliations"": ""RRII (Rubber Research Institute of India), India ; Univ Adelaide, Australia""}"
clapas_corynespora_394,CLAPAS-corynespora,Screening Susceptibility of Hevea Progenies from PB 5/51 X IAN 873 to Two Races of Corynespora cassiicola,"Screening Susceptibility of Hevea Progenies from PB 5/51 X IAN 873 to Two Races of Corynespora cassiicola Two races of Corynespora cassiicola have been found to affect immature and mature leaves of Hevea brasiliensis in Malaysia. Immature and mature leaves of 20 randomly selected progenies from family PB 5/51 X IAN 873 were used to screen resistance/susceptibility to isolates CSB 16 (race 1) and CLN 16 (race 2) separately. Analysis of Variance (ANOVA) and the Least Significant Difference (LSD) test at a 0.05 probability level were used to compare treatment means. The multifactor ANOVA was used to analyse the results which include main effects and interactions between factors studied viz, progenies, leaf types and isolates. Immature leaves were more susceptible to both races than mature leaves and isolate CLN 16 (race 2) was the more virulent to this Hevea family. This study was able to detect five progenies that were resistant to both fungal isolates. They were progenies 1636, 1747, 3223, 3320 and 3562.","{""author_keywords"": ""Corynespora cassiicola; leaf types; isolate; races; disease severity"", ""affiliations"": ""RRIM (Rubber Research Institute of Malaysia), Malaysia ; Universiti Putra Malaysia, Malaysia""}"
clapas_corynespora_395,CLAPAS-corynespora,Inhibition of conidial germination and mycelial growth of Corynespora cassiicola (Berk and Curt) of rubber (Hevea brasiliensis muell. Arg.) using extracts of some plants,"Inhibition of conidial germination and mycelial growth of Corynespora cassiicola (Berk and Curt) of rubber (Hevea brasiliensis muell. Arg.) using extracts of some plants Twenty-one plants were screened for fungicidal effects on conidial germination and mycelial growth of Corynespora cassiicola. Out of this, 5 plants (Ageratum conyzoides, Centrosema pubescene, Emilia coccinea, Ocimum basilicum and Solanum torvum) were selected for evaluation of concentration effects. Treatment in O. basilicum resulted in the lowest mycelial growth at 100% extract concentration. An in vivo evaluation showed that treatment with 100% O. basilicum resulted in disease index (D.I) of 43% which was significantly lower than the control 65% D.I at 5% level of probability.","{""author_keywords"": ""Corynespora cassiicola; Conidial and Mycelial inhibition; plant extracts"", ""affiliations"": ""RRIN (Rubber Research Institute of Nigeria), Nigeria ; University of Benin (Nigeria), Nigeria""}"
clapas_corynespora_396,CLAPAS-corynespora,Genetic variation in Corynespora cassiicola:: a possible relationship between host origin and virulence,"Genetic variation in Corynespora cassiicola:: a possible relationship between host origin and virulence Genetic variation of 42 isolates of Corynespora cassiicola, a destructive fungal pathogen of many economically important crop plants including rubber, was investigated using RAPD-PCR analysis. Five genetic groups were identified using RAPD-PCR profiles generated by eight random primers. Results indicate that there is a significant genetic variation among C. cassiicola isolates collected from different host plants. These results should facilitate the development of rubber clones with enhanced resistance against all genetic groups of C. cassiicola.","{""author_keywords"": """", ""affiliations"": ""RRISL (Rubber Research Institute of Sri Lanka), Sri Lanka ; Univ Colombo, Sri Lanka""}"
clapas_corynespora_397,CLAPAS-corynespora,Variability of Hevea isolates of Corynespora cassiicola from Sri Lanka,"Variability of Hevea isolates of Corynespora cassiicola from Sri Lanka Corynespora cassiicola cause a devastating disease on Hevea brasiliensis. The diversity in symptoms illustrated in this study is a unique feature of this pathogen and it is a serious limitation in diagnosing the disease under field conditions. Colony and reproductive morphology, conidia and toxin production, pathogenicity and sensitivity to fungicides varied greatly among the isolates. Pathogen sporulation and toxin production correlated positively with pathogenicity. Based on the results three pathogenic groups were identified.","{""author_keywords"": ""cultural morphology; pathogenicity; reproductive morphology; symptoms"", ""affiliations"": ""RRISL (Rubber Research Institute of Sri Lanka), Sri Lanka ; Univ Colombo, Sri Lanka""}"
clapas_corynespora_398,CLAPAS-corynespora,Evaluation of screening methods against Corynespora leaf fall disease of rubber (Hevea brasiliensis),"Evaluation of screening methods against Corynespora leaf fall disease of rubber (Hevea brasiliensis) Identification of resistant clones is a major strategy in the management of Corynespora leaf fall disease (CLFD) of rubber. Several methods to identify resistance/susceptibility were examined in this study. There were significant variations in the mean lesion scores of different clones when evaluated by laboratory based in vitro assays. When screened in a bud wood nursery, the lesion types agreed with the symptoms observed in field plants. Analysis of results of clones screened under natural conditions showed that 85% of the clones in the Rubber Research Institute of Sri Lanka (RRISL) recommendation list can be ranked as resistant. The results of this investigation suggest that laboratory based in vitro screening methods should be used only for preliminary data. Field experiments, though dependable, take a considerably longer period. As such the bud wood nursery experiments which takes a much shorter time can be recommended to screen planting material for resistance or susceptibility to CLFD.","{""author_keywords"": ""conidia; Corynespora leaf fall disease; Hevea brasiliensis; screening methods; toxic metabolite"", ""affiliations"": ""RRISL (Rubber Research Institute of Sri Lanka), Sri Lanka ; Univ Colombo, Sri Lanka""}"
clapas_corynespora_399,CLAPAS-corynespora,Screening of fungicides against Corynespora leaf fall disease of rubber under nursery conditions,"Screening of fungicides against Corynespora leaf fall disease of rubber under nursery conditions Quality planting material is a basic requirement for the increase in productivity levels and one of the key indicators of quality is the health of nursery plants. Corynespora leaf fall disease (CLFD) affects all clones of rubber under nursery condition. In this investigation the most effective treatment to manage CLFD in nurseries was the introduction of overhead shading together with application of the fungicide mancozeb. The fungicide mixture (carbendazim + mancozeb) applied at 7-d intervals, and carbendazim sprayed at 2-week intervals together with shade showed equally good results. Carbendazim (0.5 g l(-1)) sprayed at 7- or 10-d intervals, the application of other fungicides, mancozeb, metalaxyl 8% + mancozeb 64%, captan and propineb, at 3 g l(-1) at 7-d intervals was also effective. Though the systemic fungicide, carbendazim efficiently controlled the disease, tebuconazole and hexaconazole were found to be much less effective.","{""author_keywords"": ""cultural practices; fungicides; Hevea brasiliensis; nursery disease management"", ""affiliations"": ""RRISL (Rubber Research Institute of Sri Lanka), Sri Lanka ; Univ Colombo, Sri Lanka""}"
clapas_corynespora_400,CLAPAS-corynespora,Genetic Diversity and Pathogenicity of Corynespora cassiicola Isolates from Rubber Trees and Other Hosts in Vietnam,"Genetic Diversity and Pathogenicity of Corynespora cassiicola Isolates from Rubber Trees and Other Hosts in Vietnam A total of 38 isolates of Corynespora cassiicola collected from rubber trees and other hosts including papaya (Papaya carica), Ecdysanthera rosea, wild mango (Irvingia malayana), white pumpkin (Benincasa cerifera) and sesame (Sesamum indicum)from different regions of Vietnam were studied for genetic diversity analysis using ribosomal DNA internal transcribed spacer (rDNA ITS) sequencing and inter simple sequence repeat (ISSR) markers. A single nucleotide polymorphism at the 135th base (Cytosine/Thymine) of the rDNA-ITS regions differentiated 38 studied isolates into two groups. Meanwhile, 88 DNA bands amplified by eight ISSR primers also generated a phylogenetic tree which clustered the studied isolates into two main groups. This was harmonious from that differentiated using the sequence of rDNA-ITS. Four of these studied isolates representing two genetic clusters and hosts were subjected to pathogenicity test using detached leaf assay and artificial inoculation in glasshouse on plantlets of seven rubber clones, white pumpkin and papaya. These isolates showed different virulence on these hosts, which was displayed by the variation in the percentage disease intensity (PDI) and average infection score (AIs). Though belonging to the same genetic cluster, C. cassiicola isolated from papaya was avirulent to white pumpkin, whereas the isolate from white pumpkin was virulent to papaya. Isolates from white pumpkin and papaya were virulent to all tested rubber clones. It seemed that the genetic relationship among isolates depends on the geographical region rather than the host source.","{""author_keywords"": ""C. cassiicola; inter simple sequence repeat (ISSR); rDNA ITS sequence; single nucleotide polymorphisms (SNPs); pathogenicity test"", ""affiliations"": ""RRIV (Rubber Research Institute of Vietnam), Vietnam""}"
clapas_corynespora_401,CLAPAS-corynespora,"First Report of Corynespora cassiicola Causing Fruit Rot of Pomegranate in India, Its Morphological and Molecular Characterization","First Report of Corynespora cassiicola Causing Fruit Rot of Pomegranate in India, Its Morphological and Molecular Characterization A new fungal pathogen, Corynespora cassiicola was isolated from infected pomegranates from orchards of Maharashtra. It causes a mild form of rot in pomegranates. The pathogen was isolated from only 5.12% of infected pomegranates of Bhagwa and Ganesh varieties. It produced approximately 12mm rot on artificially infected pomegranates and necrosis was 8mm deep after 10days post inoculation. The pathogen was identified by cultural and morphological characteristics that include growth on different media and slide culture technique. Further authentication was done by the sequencing of ITS1, 5.8S and ITS2 region of rRNA gene. The accession number of sequence submitted to NCBI is KC411916. The pathogen produced plant cell wall degrading enzymes viz., pectinase, cellulase and xylanase. In artificially infected tissues, pectinase activity was maximum (19.8 U/g) followed by xylanase (15.58U/g) and cellulase (1.09U/g). Pearson correlation indicated a significant correlation (P<0.05) between disease rating scale and enzyme activity in infected tissues. The elevated levels of pectinase, cellulase and xylanase suggest their possible role in pathogenesis and tissue degradation. Enzyme inhibitors from biocontrol agents may be further studied to prevent the progress of infection. This is the first description of characterization of C. cassiicola as a pomegranate fruit rot pathogen.","{""author_keywords"": ""Pomegranate; Fruit rot; Virulence factors; Corynespora cassiicola; ITS"", ""affiliations"": ""Savitribai Phule Pune University, India ; Tuljaram Chaturchand College of Arts, Science and Commerce, India""}"
clapas_corynespora_402,CLAPAS-corynespora,"CARD9 MUTATION LINKED TO SUBCUTANEOUS INFECTION CAUSED BY CORYNESPORA CASSIICOLA, A PLANT PATHOGEN","CARD9 MUTATION LINKED TO SUBCUTANEOUS INFECTION CAUSED BY CORYNESPORA CASSIICOLA, A PLANT PATHOGEN","{""author_keywords"": ""Corynespora cassiicola; CARD9; mutation"", ""affiliations"": ""Shandong Academy of Medical Sciences, Peoples R China ; Shandong Univ, Peoples R China""}"
clapas_corynespora_403,CLAPAS-corynespora,Evaluation of bioactivity and control efficacy of tetramycin against Corynespora cassiicola,"Evaluation of bioactivity and control efficacy of tetramycin against Corynespora cassiicola Tetramycin is a novel polyene antibiotic that has exhibited excellent inhibitory activity against many plant pathogens. In this study, the sensitivity of Corynespora cassiicola to tetramycin was assessed in vitro using a series of 91 isolates, and its effects on hyphae and conidia were evaluated. Preventive and curative efficacies of tetramycin against Corynespora leaf spot were evaluated using detached cucumber leaves and potted cucumber plants. The control efficacy of tetramycin against the pathogen was also determined under field conditions. Measurement of baseline sensitivity suggested that the frequency distribution of tetramycin fits a unimodal curve. Among several life stages, spore germination was most severely inhibited by tetramycin, whereas mycelial growth was found to be the least sensitive. Microscopy observation revealed that tetramycin treatment leads to abnormal morphological development of C. cassiicola. Overall, tetramycin exhibited excellent curative and preventive activities against C. cassiicola on both cucumber leaves and potted cucumber plants. Furthermore, tetramycin significantly reduced the disease severity of Corynespora leaf spot in the field. The results from this study showed that tetramycin may play an important role in Corynespora leaf spot disease management and promote its introduction into fungicide-application programs.","{""author_keywords"": ""Corynespora cassiicola; Tetramycin; Baseline sensitivity; Bioactivity; Preventive and curative activities; Control efficacy"", ""affiliations"": ""Shandong Agr Univ, Peoples R China""}"
clapas_corynespora_404,CLAPAS-corynespora,Development of a LAMP method for detecting the N75S mutant in SDHI-resistant Corynespora cassiicola,"Development of a LAMP method for detecting the N75S mutant in SDHI-resistant Corynespora cassiicola The replacement of asparagine with serine at codon 75 of the sdhC gene (N75S) confers succinate dehydrogenase inhibitor resistance in Corynespora cassiicola, which caused by consecutive fungicide application. To rapidly detect the mutation of N75S, a method based on loop-mediated isothermal amplification (LAMP) was developed in this study. The optimal primer set among the six primer sets designed could clearly identify N75S from the wild-type genotype. The detection threshold of the optimized LAMP mixture (10 mu L) was 8.8 fg of target DNA at 63 degrees C within 60 min. This method specifically showed a color change and ladder-like band only when DNA extracted from isolates containing the N75S mutation was added. The results of stability tests suggested a satisfactory repeatability of this method. Additionally, the assay could positively distinguish N75S mutants from crude DNA isolated from conidia and mycelia of C. cassiicola. Given the high efficiency, sensitivity, specificity, repeatability and simplicity of operation, the LAMP method established here could be useful to evaluate the shift in the sensitivity of C. cassiicola to SDHIs and will provide significant data for the management of Corynespora leaf spot.","{""author_keywords"": ""LAMP; N75S mutation; Resistance detection; Corynespora cassiicola"", ""affiliations"": ""Shandong Agr Univ, Peoples R China""}"
clapas_corynespora_405,CLAPAS-corynespora,Evaluation of Sensitivity and Resistance Risk of Corynespora cassiicola to Isopyrazam and Mefentrifluconazole,"Evaluation of Sensitivity and Resistance Risk of Corynespora cassiicola to Isopyrazam and Mefentrifluconazole Necrotic lesions on leaves caused by Corynespora leaf spot (CLS) seriously threaten the quality and yield of cucumber in China. Corynespora cassiicola has developed different degrees of sensitivity to various fungicides due to its long-term and extensive application. In our work, the effect of isopyrazam and mefentrifluconazole on different life stages of C. cassiicola was examined. To determine the optimal effect of binary mixtures of isopyrazam and mefentrifluconazole, the two fungicides were mixed at different proportions. Furthermore, the disease suppression of isopyrazam, mefentrifluconazole, and their compound mixture against CLS was evaluated in greenhouse experiments. Ultraviolet (UV) mutagenesis and fungicide-selection methods were performed to assess the risk of resistance development. Among the three life stages tested, isopyrazam showed the weakest inhibition on mycelial growth, and mefentrifluconazole showed the strongest inhibition of germ tube elongation. According to Wadley's and cotoxicity coefficient methods, the optimal proportion of the two-component mixture of isopyrazam and mefentrifluconazole was 1:1. Isopyrazam, mefentrifluconazole, and their binary mixture at 1:1 reduced the disease severity of CLS on potted cucumber plants, with protective effects of 31.11, 24.65, and 42.12% and curative effect of 33.90, 37.48, and 42.84%, respectively. Compared with isopyrazam or mefentrifluconazole alone, the binary mixture of the two fungicides at 1:1 did not exert significant influence on the change of C. cassiicola sensitivity. Undoubtedly, such data will greatly facilitate the screening of new fungicides for CLS and resistance management.","{""author_keywords"": ""Corynespora cassiicola; isopyrazam; mefentrifluconazole; binary mixture; resistance risk assessment"", ""affiliations"": ""Shandong Agr Univ, Peoples R China""}"
clapas_corynespora_406,CLAPAS-corynespora,A bioactivity and biochemical analysis of iminoctadine tris (albesilate) as a fro fungicide against Corynespora cassiicola,"A bioactivity and biochemical analysis of iminoctadine tris (albesilate) as a fro fungicide against Corynespora cassiicola Iminoctadine tris (albesilate) is a bis-guazatine fungicide, and its specific modes of action and efficacy against C. cassiicola are not yet clear. In this study, baseline sensitivity data for mycelial growth showed that the frequency distribution curve of iminoctadine tris (albesilate) EC50 values is unimodal. The EC50 values ranged from 0.1151 to 1.2101 mu g/mL, with a mean of 0.5775 +/- 0.2677 mu g/mL. Iminoctadine tris (albesilate) affected the morphological development of C. cassiicola, causing increased branching of the mycelium. The significant increase in membrane permeability and malondialdehyde content after iminoctadine tris (albesilate) treatment indicated that this fungicide caused severe damage to the membrane structure. Furthermore, 0.4 mu g/mL iminoctadine tris (albesilate) could decrease the spore density of C. cassiicola from 2.6200 x 10(4) to 1.4967 x 10(4)/cm(2) on average in vitro, indicating that the fungicide had great potential to reduce secondary infection with C. cassiicola in the field. Additionally, 120 mu g/mL iminoctadine tris (albesilate) provided over 95% curative efficacy and 81.17% preventative efficacy on detached cucumber leaves inoculated with C. cassiicola. In field trials, iminoctadine tris (albesilate) at a dose of 120 g a.i./ha exhibited 72.92% and 80.92% control efficacy in 2017 and 2018, respectively. However, the efficacy supplied by the reference fungicide azoxystrobin at 250 g a.i./ha was only approximately 50% due to the development of fungicide resistance in C. cassiicola. Taken together, the findings above provide a solid foundation for the exploration of the action mechanisms of iminoctadine tris (albesilate) against C. cassiicola and provide overwhelming evidence for the use of iminoctadine tris (albesilate) as an excellent potential alternative fungicide in the management of cucumber Corynespora leaf spot.","{""author_keywords"": ""Iminoctadine tris (albesilate); Corynespora cassiicola; Bioactivity; Biochemical; Control efficacy"", ""affiliations"": ""Shandong Agr Univ, Peoples R China""}"
