id,source,title,text,metadata
clapas_corynespora_238,CLAPAS-corynespora,Corynespora cassiicola IN SOYBEAN SEEDS - INCIDENCE AND TRANSMISSION,"Corynespora cassiicola IN SOYBEAN SEEDS - INCIDENCE AND TRANSMISSION The fungus Corynespora cassiicola, the causal agent of the target spot in soybeans, has been considered, from the seed pathology point of view, a seed-borne pathogen of limited importance. Therefore, little importance has been given to the role of the seeds in the transmission of this pathogen. The objectives of this study were to determine the incidence of C. cassiicola in soybean seeds and evaluate the effects of this seed-borne pathogen, inoculated in the seeds, concerning to physiological and epidemiological parameters. The experiments were carried out at TAGRO and Embrapa Western Agriculture under lab (blotter test and seed germination test) and greenhouse conditions (growing on test). The fungus C. cassiicola was detected in 11.3% of the 639 seed samples analyzed, with an average incidence of 0.91% and a maximum of 8.5%. The transmission of C. cassiicola from the seeds to above-ground parts of soybean seedlings was demonstrated, by pathogen establishment on the cotyledon, showing circular lesions with concentric rings, reddish-brown in the center and surrounded by a yellowish-green halo, as a typical symptom of target spot. Reddish-brown lesions on the roots and stem of the seedlings were also observed. Considering a sample seed with 66.0% of C. cassiicola incidence, the symptomatic transmission based on cotyledon symptoms was 42.2%, corresponding to a transmission rate of 2.4:1. This is the first report, in a quantified way, about the transmission of C. cassiicola from the seeds to above-ground parts of soybean seedlings. When compared to non-inoculated seeds, seed germination, seedling emergence, and seedling initial development were influenced by the presence of the pathogen in the seeds, with the lowest values being observed when the seeds were inoculated.","{""author_keywords"": ""Seed pathology; Target spot"", ""affiliations"": ""EMBRAPA (Empresa Brasileira de Pesquisa Agropecuaria), Brazil ; TAGRO Tecnol Agr Ltda, Brazil""}"
clapas_corynespora_239,CLAPAS-corynespora,"Phylogenetic network analysis of South and North American Corynespora cassiicola isolates from tomato, cucumber, and novel hosts","Phylogenetic network analysis of South and North American Corynespora cassiicola isolates from tomato, cucumber, and novel hosts Corynespora cassiicola isolates display morphological, pathogenic, and ecological diversity, inducing target spot-like diseases in more than 500 hosts worldwide, including tomato and cucumber. Nevertheless, there is a scarce number of studies about the genetic variability of Corynespora isolates in the New World. Here, we characterized a collection of 58 Corynespora isolates from tomatoes and distinct hosts in Brazil and Florida (USA). All isolates were identified as C. cassiicola according to the sequencing information of the internal transcribed spacer (ITS) region of 18S-28S nuclear ribosomal DNA as well as the translation elongation factor 1-alpha (tef-1 alpha) and beta-tubulin (tub2) genes. However, intraspecific resolution was observed in phylogenetic analyses according to the geographical and host origin of the isolates. The beta-tubulin (tub2) haplotype network was in agreement with phylogenetic analyses, revealing a polyphyletic structure with three well-defined phylogenetic lineages. The concatenated trees (encompassing all three genomic regions) showed superior intraspecific resolution than the individual phylogenetic trees. Thirteen selected C. cassiicola isolates (representing all three phylogenetic lineages) displayed variability in colony morphology (color, texture, growth rate, and shape) and in conidial morphometrics. Three selected C. cassiicola isolates confirmed their pathogenicity to the original hosts and to other plant species. Novel natural and experimental host-pathogen interactions were identified, including cabbage, Commelina benghalensis, eggplant, Eruca sativa, Hibiscus sabdariffa, and melon. The diversity of C. cassiicola isolates indicates that these phylogenetic lineages may represent a complex of closely related species with distinct patterns of host and cultivar-specificity.","{""author_keywords"": ""Host range; Morphology; Network analysis; Pathogenicity; Phylogeny; Target spot"", ""affiliations"": ""EMBRAPA (Empresa Brasileira de Pesquisa Agropecuaria), Brazil ; Univ Brasilia, Brazil ; Univ Fed Rural Pernambuco UFRPE, Brazil ; Univ Florida, USA""}"
clapas_corynespora_240,CLAPAS-corynespora,In-vitro sensitivity to fungicides of Corynespora cassiicola isolates from different hosts and geographic regions from Brazil,"In-vitro sensitivity to fungicides of Corynespora cassiicola isolates from different hosts and geographic regions from Brazil No fungicides are specifically registered for the control of Corynespora cassiicola on tomato or cucumber in Brazil. Current control is achieved through the use of fungicides registered for early blight on tomato or for target spot on soybean. This constitutes an illegal and inappropriate use of fungicides that may compromise the effectiveness of some products. Our objective was to determine the sensitivity of C. cassiicola isolates from different hosts and geographic regions of Brazil to several common fungicides. In-vitro tests on fungicide-amended media were performed using C. cassiicola isolates to determine the effective dose necessary to decrease mycelial growth by 50% (ED50), relative to growth on a non-amended medium. The fungicides chlorothalonil and carbendazim exhibited an average ED50 of >50 mg L-1. For tebuconazole, the ED50 varied from 0.50 to 18.79 mg L-1. The ED50 values for pyrimethanil, fludioxonil and cyprodinil were substantially lower, with average values of <= 10 mg L-1. Discriminatory rates of 1 mg L-1 for fludioxonil, 3 mg L-1 for cyprodinil, 5 mg L-1 for boscalid and fluopyram, and 10 mg L-1 for tebuconazole, azoxystrobin and pyrimethanil were used to differentiate the sensitivity of additional isolates to each fungicide based on percentage mycelial growth inhibition (MGI). Based on MGI, great variation for each fungicide was observed among the 55 C. cassiicola isolates tested. Fludioxonil showed the highest efficacy against C. cassiicola isolates compared with the other fungicides tested, with all isolates classified as sensitive (MGI >50%). Chlorothalonil showed the lowest efficacy, with 91% of tested isolates exhibiting an MGI <50%. Based on MGI, isolate EH-1068 was considered insensitive to seven of the nine fungicides tested, while isolate EH-1720 was considered sensitive to eight fungicides. The results showed that fludioxonil would be a good option for the control of target spot.","{""author_keywords"": ""chemical control; target spot"", ""affiliations"": ""EMBRAPA (Empresa Brasileira de Pesquisa Agropecuaria), Brazil ; Univ Brasilia, Brazil ; Univ Florida, USA""}"
clapas_corynespora_241,CLAPAS-corynespora,Sensitivity of Corynespora cassiicola from soybean to carbendazim and prothioconazole,"Sensitivity of Corynespora cassiicola from soybean to carbendazim and prothioconazole The incidence of target spot disease on soybean has increased in recent years in Brazil even with intensive use of fungicides, and fungal resistance has been reported in recent studies. The objective of this study was to determine the fungicide sensitivity to carbendazim and prothioconazole in a sample of 24 isolates of Corynespora cassiicola from soybean collected from 1996 to 2011 in the states of Parana, Mato Grosso and Sao Paulo (Brazil) and Corpus Christi (Paraguay). The 50% effective concentration (EC50) values were estimated by the relative mycelium growth reduction on fungicide-amended medium with the doses of 0, 0.5, 1, 10, 100 and 1000 mu g of active ingredient/ mL. For carbendazim, four highly resistant isolates (EC50 >= 50 mu g/mL) were observed from samples collected from Mato Grosso in 2008 and from Parana and Mato Grosso in 2011. The EC50 values for prothioconazole ranged from 0.47 mu g/mL to 26.44 mu g/mL (mean: 5.02 mu g/ml). The results reinforce the occurrence of C. cassiicola resistance to benzimidazole in Parana and Mato Grosso states.","{""author_keywords"": ""benzimidazole; fungicide resistance; triazole"", ""affiliations"": ""EMBRAPA (Empresa Brasileira de Pesquisa Agropecuaria), Brazil ; Univ Estadual Londrina, Brazil""}"
clapas_corynespora_242,CLAPAS-corynespora,Conventional PCR for detection of Corynespora cassiicola in soybean seeds,"Conventional PCR for detection of Corynespora cassiicola in soybean seeds The fungus Corynespora cassiicola, causal agent of target spot in soybeans, can be transmitted by soybean seeds and as of that point cause severe damage. This disease may be diagnosed at an early stage by seed testing, but knowledge in this area is insufficient. Because of that and increased attack by the disease in soybean areas in Brazil, further studies are required. The aim of this study was to evaluate the use of conventional PCR in detecting C. cassiicola in soybean seeds. The GA4-F/GA4-R primers described in the literature were tested for their specificity and sensitivity for detection of C. cassiicola in pure culture and in soybean seeds. Uninoculated and inoculated seed samples were used with different incidence levels 100%, 10%, 1%, 0.5%, 0.25%, and 0% of preestablished inoculum potentials, P0, P1, P2, and P3. Detection of C. cassiicola in P1 inoculum potential was observed in samples with incidence levels of 10% to 100%. In the P3 potential, detection of the pathogen was successful in samples at the low level of 0.25%.","{""author_keywords"": ""seed pathology; target spot; electrophoresis"", ""affiliations"": ""EMBRAPA (Empresa Brasileira de Pesquisa Agropecuaria), Brazil ; Univ Fed Lavras, Brazil""}"
clapas_corynespora_243,CLAPAS-corynespora,Rhizobacterial induction of systemic resistance in tomato plants: non-specific protection and increase in enzyme activities,"Rhizobacterial induction of systemic resistance in tomato plants: non-specific protection and increase in enzyme activities Rhizobacteria B101R, B212R, and A068R, selected as inducers of systemic resistance against Pseudomonas syringae pv. tomato, were tested individually for biological control of multiple pathogens causing foliar diseases in tomato plants. Greenhouse bioassays were carried with five pathogens-Alternaria solani (early blight), Corynespora cassiicola (foliar blight), Oidium lycopersici (powdery mildew), Stemphilium solani (leaf spot), and Xanthomonas campestris pv. vesicatoria (bacterial spot). The level of control achieved by each rhizobacterium. varied with the pathosystem studied. Isolate B101R afforded reduced disease intensity in terms of average number of leaf lesions as compared to the treatment control, protection against A. solani, S. solani, and O. lycopersici. Lipoxygenase, phenylalanine amonia-lyase, and peroxidase activities were estimated spectrophotometrically in extracts of plants grown from seeds that were microbiolized with rhizobacterium B101R, and inoculated with P. syringae pv. tomato. Increases in peroxidase and lipoxygenase activities were detected in foliar extracts from plants whose seeds had been microbiolized, while no increase in phenylalanine amonia-lyase activity was observed. (C) 2003 Elsevier Inc. All rights reserved.","{""author_keywords"": ""Pseudomonas syringae pv. tomato; Alternaria solani; Corynespora cassiicola; Stemphilium solani; Oidium lycopersici; Xanthomonas campestris pv. vesicatoria; Bacillus cereus; biological control; rhizobacteria; induced systemic resistance; lipoxygenase; phenylalanine amonia-lyase; peroxidase"", ""affiliations"": ""EMBRAPA (Empresa Brasileira de Pesquisa Agropecuaria), Brazil ; Univ Fed Vicosa, Brazil""}"
clapas_corynespora_244,CLAPAS-corynespora,Reaction of soybean cultivars to Corynespora cassiicola,"Reaction of soybean cultivars to Corynespora cassiicola Reaction of soybean cultivars to Corynespora cassiicola The fungus Corynespora cassiicola, the causal agent of soybean target spot, frequently occurs in the Brazilian midwestern region. Under favorable climate conditions it can cause serious damage to this crop. The use of resistant cultivars is recommended although there are only a few available in the market. This investigation was carried out to evaluate the reaction of twelve soybean commercial cultivars to C. cassiicola. Severity was evaluated using a diagrammatic scale of target spot. The less susceptible cultivars in greenhouse were BRSGO 7960 and BRS Sambaiba and the most susceptible were BMX Potencia RR and M-SOY 7908 RR. In the field, the less susceptible cultivars were M-SOY 8866, M-SOY 7908 RR and BMX Potencia RR and the most susceptible were BRSGO 8360 and BRS Tracaja.","{""author_keywords"": ""Glycine max; genetic resistance; target spot"", ""affiliations"": ""EMBRAPA (Empresa Brasileira de Pesquisa Agropecuaria), Brazil ; Universidade Federal de Goias, Brazil""}"
clapas_corynespora_245,CLAPAS-corynespora,First Report of Target Spot on Tomato Caused by Corynespora cassiicola in Mauritius,First Report of Target Spot on Tomato Caused by Corynespora cassiicola in Mauritius,"{""author_keywords"": ""fungi; tomatoes; pathogen detection; target spot"", ""affiliations"": ""FAREI (Food and Agricultural Research and Extension Institute), Mauritius ; Univ Belgrade, Serbia ; Univ Mauritius, Mauritius ; Univ Pretoria, South Africa""}"
clapas_corynespora_246,CLAPAS-corynespora,New Metabolite from the Endophytic Fungus Corynespora smithii,"New Metabolite from the Endophytic Fungus Corynespora smithii A new isopimarane-type diterpene glycoside, named hypomonticuside (1), was isolated from the BuOH-soluble fraction of the liquid fermentation of an endophytic fungus Corynespora smithii, derived from the stems of Ardisia cornudentata Mez (Myrsinaceae). The structure of 1 was elucidated by spectroscopic methods, including UV, IR, HR-ESI-MS, and extensive 1D and 2D NMR techniques.","{""author_keywords"": ""Hypoxylon monticulosum; Xylariaceae; diterpene; secondary metabolite"", ""affiliations"": ""FIRDI (Food Industry Research and Development Institute), Taiwan ; Kaohsiung Med Univ, Taiwan""}"
clapas_corynespora_247,CLAPAS-corynespora,Isolation and molecular characterization of the fungal endophytic microbiome from conventionally and organically grown avocado trees in South Florida,"Isolation and molecular characterization of the fungal endophytic microbiome from conventionally and organically grown avocado trees in South Florida Fungal endophytes are the most ubiquitous and highly diverse microorganisms that inhabit the interior of healthy plants. They are important in plant ecology and offer untapped potential to improve plant health and productivity in agroecosystems. The endophytic assemblage of avocado is poorly understood; therefore, surveys of fungal endophytes of Persea americana Mill. (Avocado) in South Florida organic and conventional orchards were conducted. A total of 17 endophytic fungal species were recovered from healthy avocado terminal branches. Endophytic fungal species were identified by rDNA sequencing of the internal transcribed spacer (ITS) region, using UNITE Species Hypotheses to reliably assign a taxon name, and determined as belonging to the genera Alternaria, Cladosporium, Colletotrichum, Corynespora, Diaporthe, Lasiodiplodia, Neofusicoccum, Neopestalotiopsis, Phyllosticta, and Strelitziana. Endophyte community assemblage differed between organic and conventional agroecosystems. This is the first report of Alternaria eichhorniae, Cladosporium tenuissimum, Corynespora cassiicola, Colletotrichum alatae, Diaporthe fraxini-angustifoliae, Lasiodiplodia gonubiensis, Neofusicoccum algeriense, Neofusicoccum andinum, Neopestalotiopsis foedans, Phyllosticta capitalensis, and Strelitziana africana as endophytes of avocado. Evaluation using pathogenicity tests on avocado leaves and terminal branches showed that endophytic fungal isolates did not cause disease symptoms.","{""author_keywords"": ""Persea americana; Host-fungal association; New host record; Plant pathogen; Agroecosystem"", ""affiliations"": ""Florida Int Univ, USA ; Tennessee Technol Univ, USA""}"
clapas_corynespora_248,CLAPAS-corynespora,"The Sorting and Transport of the Cargo Protein CcSnc1 by the Retromer Complex Regulate the Growth, Development, and Pathogenicity of Corynespora cassiicola","The Sorting and Transport of the Cargo Protein CcSnc1 by the Retromer Complex Regulate the Growth, Development, and Pathogenicity of Corynespora cassiicola In eukaryotes, the retromer complex is critical for the transport of cargo proteins from endosomes to the trans-Golgi network (TGN). Despite its importance, there is a lack of research on the retromer-mediated transport of cargo proteins regulating the growth, development, and pathogenicity of filamentous fungi. In the present study, transcriptome analysis showed that the expression levels of the retromer complex (CcVPS35, CcVPS29 and CcVPS26) were significantly elevated during the early stages of Corynespora cassiicola invasion. Gene knockout and complementation analyses further highlighted the critical role of the retromer complex in C. cassiicola infection. Subcellular localization analysis showed that the retromer complex was mainly localized to the vacuolar membrane and partially to endosomes and the TGN. Further research found that the retromer core subunit CcVps35 can interact with the cargo protein CcSnc1. Subcellular localization showed that CcSnc1 is mainly located at the hyphal tip and partially in endosomes and the Golgi apparatus. Deletion of CcVPS35 resulted in the missorting of CcSnc1 into the vacuolar degradation pathway, indicating that the retromer can sort CcSnc1 from endosomes and transport it to the TGN. Additionally, gene knockout and complementation analyses demonstrated that CcSnc1 is critical for the growth, development, and pathogenicity of C. cassiicola. In summary, the vesicular transport pathway involving the retromer complex regulates the sorting and transport of the cargo protein CcSnc1, which is important for the growth, development and pathogenicity of C. cassiicola.","{""author_keywords"": ""retromer; cargo sorting; fungal development; pathogenicity; Corynespora cassiicola"", ""affiliations"": ""Fujian Agr & Forestry Univ, Peoples R China ; Jiangxi Agr Univ, Peoples R China ; Jiujiang Agricultural Technology Extension Center, Peoples R China""}"
clapas_corynespora_249,CLAPAS-corynespora,Integrated control of target spot and yield of cotton in the Brazilian cerrado biome,"Integrated control of target spot and yield of cotton in the Brazilian cerrado biome Target spot is a disease that has caused serious damage to cotton crops. This study was carried out to examine if different cotton genotypes, plant heights and fungicide treatments can be used as tools of an integrated control methods of target spot The experiment was carried out in the 2014/15 crop season, in cerrado biome of Chapaciao do Sul - MS, Brazil. It was used a randomized block design in a 2 x 3 x 3 factorial arrangement with four replicates. The factors were two plant heights (1 and 1.5 m), three cultivars (FMT 701, FM 975, and FM 944), and three fungicide treatments (control, FT1, and FT2). Fungicide treatments consisted of sequential applications of different fungicides of the triazole, strobilurin, and carboxamide groups. Cultivar FM 944 showed lower susceptibility to target spot The shorter plants exhibited lower disease severity. The fungicides pyraclostrobin + fluxapyroxad and trifloxystrobin + prothioconazole reduced the severity of target spot. Cultivar FM 975 had the highest yield. A higher yield was obtained in the upper stratum than in the lower stratum of the plant.","{""author_keywords"": ""Corynespora cassiicola; Sustainability; Control; Management"", ""affiliations"": ""Fundacao Apoio Pesquisa Agr Chapadao, Brazil ; Univ Fed Mato Grosso do Sul (UFMS), Brazil""}"
clapas_corynespora_250,CLAPAS-corynespora,Development and validation of diagrammatic scale to assess target spot severity in cotton,"Development and validation of diagrammatic scale to assess target spot severity in cotton Due to the emergence of target spot disease on cotton, caused by the fungus Corynespora cassiicola, the aim of this study was the development and validation of a diagrammatic scale to assess the severity of target spot on cotton leaves using Lin's statistic and linear regression models. For the design of the scale, 200 cotton leaves were collected from naturally infected plants. Severity was measured by APS assess image analysis software. The diagrammatic scale was developed with seven levels of severity: 1%, 2%, 5%, 9%, 19%, 37 and 53%. Validation was determined by severity estimates of 50 leaves by five experienced and five inexperienced evaluators. The first assessment was performance without a scale and the second with a scale aid. The data were analyzed by two methods: Lin's statistics and linear regression. The diagrammatic scale aid reduced the absolute and relative error and improved precision (R-2=0.79 and 0.91 without and with the scale, respectively). Evaluators overestimated the severity without the scale. Agreement (Lin's concordance correlation coefficient, p(c)=0.83 and 0.94, without and with the scale, respectively) and accuracy (Bias correction factor, C-b=0.93 and 0.98, without and with the scale, respectively) were improved with the scale. The agreement between experience evaluators was higher with the scale. The use of the proposed diagrammatic scale contributed to assessment of target spot in cotton leaves by improving inter- and intra-rater reliability and accuracy of experienced and inexperienced evaluators.","{""author_keywords"": ""Corynespora cassiicola; Phytopathometry; Lin's concordance; reliability; Gossypium hirsutum"", ""affiliations"": ""Fundacao Chapadao, Brazil ; Univ Estadual Londrina, Brazil""}"
clapas_corynespora_251,CLAPAS-corynespora,Endophytic fungal assemblages of Zanthoxylum oxyphyllum Edgew. and their antimicrobial potential,"Endophytic fungal assemblages of Zanthoxylum oxyphyllum Edgew. and their antimicrobial potential Zanthoxylum oxyphyllum Edgew. is a medicinal plant widely been used by the local tribal communities of Assam as an alternative source of medicine for the treatment of various diseases. In the present study, endophytic fungi associated with Z. oxyphyllum were undertaken with an aim to investigate the isolates for their antimicrobial potential. The endophytic fungi were recovered using four different media, namely, Malt Extract Agar (MEA) media, Potato Dextrose Agar (PDA) media, Water Agar (WA) media and media amended with the Plant Extract (PEA) from samples collected from three sites. Altogether, 18 isolates of endophytic fungi were isolated from 150 surface sterilized and healthy leaf fragments. Colletotrichum was found to be dominant endophytic genus with 7 different species. Other isolated endophytic fungal genera were Fusarium, Curvularia, Aspergillus, Corynespora and isolates belonging non-sporulating fungi categorised as Mycelia Sterilia. The endophytic fungi were determined for antimicrobial activity against selected clinically significant human pathogenic test organisms. Ethyl acetate crude extracts of all endophytic fungi exhibited antimicrobial activity by inhibiting a minimum of one of the four test pathogens. Amongst the isolates, crude extracts obtained from Fusarium sp. and five Colletotrichum spp. showed wide-spectrum antimicrobial activity against all the test organisms. The study indicated that Z. oxyphyllum harbours a wide range of endophytes capable of producing secondary metabolites with antimicrobial properties. Further detailed investigation of their bioactive metabolites might lead to discovery of compounds with potential therapeutic applications as a new source of medicine.","{""author_keywords"": ""Medicinal plant; Endophytic fungi; Antimicrobial activity; Colletotrichum; Fusarium"", ""affiliations"": ""Gauhati University, India""}"
