id,source,title,text,metadata
clapas_corynespora_0,CLAPAS-corynespora,"Two new Hyphomycetes from rainforests of Mexico, and Briansuttonia, a new genus to accommodate Corynespora alternarioides","Two new Hyphomycetes from rainforests of Mexico, and Briansuttonia, a new genus to accommodate Corynespora alternarioides Corynespora aquatica anam. sp. nov. on decaying leaves of an unidentified plant submerged in a stream, and Solicorynespora sylvatica anam. sp. nov. on leaf litter, both found in tropical rainforests, are described and illustrated. Solicorynespora mulanjeensis comb. nov. is proposed, and a key to Solicorynespora species is provided. Briansuttonia gen. nov. is established to accommodate Corynespora alternarioides.","{""author_keywords"": ""submerged leaves; systematics; tropical fungi"", ""affiliations"": ""0-A v\u00e9rifier ; Bayer, Germany ; CAB International, England ; INIFAT (Instituto de Investigaciones Fundamentales en Agricultura Tropical Alejandro de Humboldt), Cuba ; Instituto de Ecologia, Mexico ; Tokyo Gakugei Univ, Japan ; Univ Rovira & Virgili, Spain""}"
clapas_corynespora_1,CLAPAS-corynespora,"Taxonomic studies of Corynespora from Yunnan, China","Taxonomic studies of Corynespora from Yunnan, China Corynespora rhapis-humilisi sp. nov. and C. flagellatum comb. nov. are described from Heikou tropical forest in Yunnan. Six new records are illustrated from the same area.","{""author_keywords"": ""hyphomycetes; new combination; Podoconis; Sporidesmium"", ""affiliations"": ""0-A v\u00e9rifier ; Shandong Agr Univ, Peoples R China""}"
clapas_corynespora_2,CLAPAS-corynespora,"Taxonomic studies of Corynespora from Guangxi, China","Taxonomic studies of Corynespora from Guangxi, China This paper provides descriptions and illustrations three new species in the hyphomycete genus Corynespora from deciduous stems or rotten wood. C. ficus-altissimae, C. donae and C. phylloshureae occurred on the hosts Ficus altissima, Dona, and Phyllostachys sulphurea, respectively.","{""author_keywords"": ""hyphomycetes; dematiaceous"", ""affiliations"": ""0-A v\u00e9rifier ; Shandong Agr Univ, Taiwan""}"
clapas_corynespora_3,CLAPAS-corynespora,First report of leaf spot caused by Corynespora cassiicola on Basil (Ocimum basilicum) in Italy,First report of leaf spot caused by Corynespora cassiicola on Basil (Ocimum basilicum) in Italy,"{""author_keywords"": """", ""affiliations"": ""0-Institution non d\u00e9sign\u00e9e""}"
clapas_corynespora_4,CLAPAS-corynespora,Fungal Planet description sheets: 868-950,"Fungal Planet description sheets: 868-950 Novel species of fungi described in this study include those from various countries as follows: Australia, Chaetomella pseudocircinoseta and Coniella pseudodiospyri on Eucalyptus microcorys leaves, Cladophialophora eucalypti, Teratosphaeria dunnii and Vermiculariopsiella dunnii on Eucalyptus dunnii leaves, Cylindrium grande and Hypsotheca eucalyptorum on Eucalyptus grandis leaves, Elsinoe salignae on Eucalyptus saligna leaves, Marasmius lebeliae on litter of regenerating subtropical rainforest, Phialoseptomonium eucalypti (incl. Phialoseptomonium gen. nov.) on Eucalyptus grandis x camaldulensis leaves, Phlogicylindrium pawpawense on Eucalyptus tereticornis leaves, Phyllosticta longicauda as an endophyte from healthy Eustrephus latifolius leaves, Pseudosydowia eucalyptorum on Eucalyptus sp. leaves, Saitozyma wallum on Banksia aemula leaves, Teratosphaeria henryi on Corymbia henryi leaves. Brazil, Aspergillus bezerrae, Backusella azygospora, Mariannaea terricola and Talaromyces pernambucoensis from soil, Calonectria matogrossensis on Eucalyptus urophylla leaves, Calvatia brasiliensis on soil, Carcinomyces nordestinensis on Bromelia antiacantha leaves, Dendryphiella stromaticola on small branches of an unidentified plant, Nigrospora brasiliensis on Nopalea cochenillifera leaves, Penicillium alagoense as a leaf endophyte on a Miconia sp., Podosordaria nigrobrunnea on dung, Spegazzinia bromeliacearum as a leaf endophyte on Tilandsia catimbauensis, Xylobolus brasiliensis on decaying wood. Bulgaria, Kazachstania molopis from the gut of the beetle Molops piceus. Croatia, Mollisia endocrystallina from a fallen decorticated Picea abies tree trunk. Ecuador, Hygrocybe rodomaculata on soil. Hungary, Alfoldia vorosii (incl.Alfoldia gen. nov.) from Juniperus communis roots, Kiskunsagia ubrizsyi (incl. Kiskunsagia gen. nov.) from Fumana procumbens roots. India, Aureobasidium tremulum as laboratory contaminant, Leucosporidium himalayensis and Naganishia indica from windblown dust on glaciers. Italy, Neodevriesia cycadicola on Cycas sp. leaves, Pseudocercospora pseudomyrticola on Myrtus communis leaves, Ramularia pistaciae on Pistacia lentiscus leaves, Neognomoniopsis quercina (incl. Neognomoniopsis gen. nov.) on Quercus ilex leaves. Japan, Diaporthe fructicola on Passiflora edulis x P. edulis f. flavicarpa fruit, Entoloma nipponicum on leaf litter in a mixed Cryptomeria japonica and Acer spp. forest. Macedonia, Astraeus macedonicus on soil. Malaysia, Fusicladium eucalyptigenum on Eucalyptus sp. twigs, Neoacrodontiella eucalypti (incl. Neoacrodontiella gen. nov.) on Eucalyptus urophylla leaves. Mozambique, Meliola gorongosensis on dead Philenoptera violacea leaflets. Nepal, Coniochaeta dendrobiicola from Dendriobium lognicornu roots. New Zealand, Neodevriesia sexualis and Thozetella neonivea on Archontophoenix cunninghamiana leaves. Norway, Calophoma sandfjordenica from a piece of board on a rocky shoreline, Clavaria parvispora on soil, Didymella finnmarkica from a piece of Pinus sylvestris driftwood. Poland, Sugiyamaella trypani from soil. Portugal, Colletotrichum feijoicola from Acca sellowiana. Russia, Crepidotus tobolensis on Populus tremula debris, Entoloma ekaterinae, Entoloma erhardii and Suillus gastroflavus on soil, Nakazawaea ambrosiae from the galleries of Ips typographus under the bark of Picea abies. Slovenia, Pluteus ludwigii on twigs of broadleaved trees. South Africa, Anungitiomyces stellenboschiensis (incl. Anungitiomyces gen. nov.) and Niesslia stellenboschiana on Eucalyptus sp. leaves, Beltraniella pseudoportoricensis on Podocarpus falcatus leaf litter, Corynespora encephalarti on Encephalartos sp. leaves, Cytospora pavettae on Pavetta revoluta leaves, Helminthosporium erythrinicola on Erythrina humeana leaves, Helminthosporium syzygii on a Syzygium sp. barkcanker, Libertasomyces aloeticus on Aloe sp. leaves, Penicillium lunae from Musa sp. fruit, Phyllosticta lauridiae on Lauridia tetragona leaves, Pseudotruncatella bolusanthi (incl. Pseudotruncatellaceae fam. nov.) and Dactylella bolusanthi on Bolusanthus speciosus leaves. Spain, Apenidiella foetida on submerged plant debris, Inocybe grammatoides on Quercus ilex subsp. ilex forest humus, Ossicaulis salomii on soil, Phialemonium guarroi from soil. Thailand, Pantospora chromolaenae on Chromolaena odorata leaves. Ukraine, Cadophora helianthi from Helianthus annuus stems. USA, Boletus pseudopinophilus on soil under slash pine, Botryotrichum foricae, Penicillium americanum and Penicillium minnesotense from air. Vietnam, Lycoperdon vietnamense on soil. Morphological and culture characteristics are supported by DNA barcodes.","{""author_keywords"": ""ITS nrDNA barcodes; LSU; new taxa; systematics"", ""affiliations"": ""0-Institution non d\u00e9sign\u00e9e ; ALVALAB, Spain ; ARC (Agricultural Research Council), South Africa ; Arctic Univ Norway, Norway ; Australia, New South Wales Government: Department of Primary Industries and Regional Development, Australia ; Australia, Queensland Government: Department of Agriculture and Fisheries, Australia ; Banaras Hindu University, India ; Beijing Forestry Univ, Peoples R China ; Bulgarian Acad Sci, Bulgaria ; CEPEC (Centro de Pesquisas do Cacau), Brazil ; CNR (Consiglio Nazionale delle Ricerche), Italy ; CREA (Council for Agricultural Research and Economics), Italy ; CSIC (Consejo Superior de Investigaciones Cientificas), Spain ; Charles Univ Prague, Czech Republic ; Chiang Mai Univ, Thailand ; Chonnam Natl Univ, South Korea ; Clark Univ, USA ; Cornell Univ, USA ; Czech Academy of Sciences, Czech Republic ; Dr: Babasaheb Ambedkar Marathwada University, India ; EMSL Analyt Inc, USA ; Eotvos Lorand Univ, Hungary ; Harvard Univ, USA ; Hosei Univ, Japan ; Hungarian Academy of Sciences, Hungary ; INTA (Instituto Nacional de Tecnologia Agropecuaria), Argentina ; Joint Russian-Vietnamese Tropical Research and Technological Center, Vietnam ; Keio Univ, Japan ; Lomonosov Moscow State Univ, Russia ; Museum of Natural History in Gorlitz, Germany ; NCPOR (National Centre for Polar and Ocean Research), India ; NINA (Norwegian Institute for Nature Research), Norway ; Natl Ctr Infect & Parasit Dis, Bulgaria ; Naturalis Biodiversity Center, Netherlands ; New Zealand. Ministry for Primary Industries, New Zealand ; Patrice Lumumba Peoples' Friendship University of Russia, Russia ; Pioneer Hi-Bred International, Spain ; Pontificia Univ Catolica Ecuador, Ecuador ; RAS (Russian Academy of Sciences), Russia ; Reconcavo Bahia Fed Univ, Brazil ; Rudjer Boskovic Institute, Croatia ; Savitribai Phule Pune University, India ; Slovak National Museum, Slovakia ; Slovak University of Technology in Bratislava, Slovakia ; Southern Oregon Univ, USA ; Ss Cyril & Methodius Univ, North Macedonia ; Surgut State Univ, Russia ; Texas Tech Univ, USA ; Tokyo Metropolitan Agr & Forestry Res Ctr, Japan ; Tribhuvan Univ, Nepal ; Tula State Lev Tolstoy Pedag Univ, Russia ; USDA-ARS (Agricultural Research Service), USA ; Univ Alcala de Henares, Spain ; Univ Amsterdam, Netherlands ; Univ Copenhagen, Denmark ; Univ Estadual Feira de Santana, Brazil ; Univ Fed Alagoas, Brazil ; Univ Fed Bahia, Brazil ; Univ Fed Brasilia, Brazil ; Univ Fed Cariri, Brazil ; Univ Fed Lavras, Brazil ; Univ Fed Mato Grosso (UFMT), Brazil ; Univ Fed Pernambuco, Brazil ; Univ Fed Rio Grande do Norte, Brazil ; Univ Fed Vicosa, Brazil ; Univ Illinois, USA ; Univ La Frontera, Chile ; Univ La Rioja, Spain ; Univ Mayor, Chile ; Univ Oslo, Norway ; Univ Pretoria, South Africa ; Univ Queensland, Australia ; Univ Rey Juan Carlos, Spain ; Univ Rovira & Virgili, Spain ; Univ Southern Queensland, Australia ; Univ Tokyo, Japan ; Univ Torino, Italy ; Univ Turin, Italy ; Univ Utrecht, Netherlands ; Univ Warsaw, Poland ; Universite Paul Valery Montpellier 3, France ; Westerdijk Fungal Biodiversity Institute, Netherlands""}"
clapas_corynespora_5,CLAPAS-corynespora,Fungal Planet description sheets: 785-867,"Fungal Planet description sheets: 785-867 Novel species of fungi described in this study include those from various countries as follows: Angola, Gnomoniopsis angolensis and Pseudopithomyces angolensis on unknown host plants. Australia, Dothiora cotymbiae on Corymbia citriodora, Neoeucasphaeria eucalypti (incl. Neoeucasphaeria gen. nov.) on Eucalyptus sp., Fumagopsis stellae on Eucalyptus sp., Fusculina eucalyptorum (incl. Fusculinaceae fam. nov.) on Eucalyptus socialis, Harknessia cotymbiicola on Corymbia maculata, Neocelosporium eucalypti (incl. Neocelosporium gen. nov., Neocelosporiaceae fam. nov. and Neocelosporiales ord. nov.) on Eucalyptus cyanophylla, Neophaeomoniella corymbiae on Corymbia citriodora, Neophaeomoniefia eucalyptigena on Eucalyptus pilularis, Pseudoplagiostoma corymbiicola on Corymbia citriodora, Teratosphaeria gracilis on Eucalyptus gracilis, Zasmidium corymbiae on Corymbia citriodora. Brazil, Calonectria hemileiae on pustules of Hemileia vastatrix formed on leaves of Coffea arabica, Calvatia caatinguensis on soil, Cercospora solani-betacei on Solanum betaceum, Clathrus natalensis on soil, Diaporthe poincianellae on Poincianella pyramidalis, Geastrum piquiriunense on soil, Geosmithia carolliae on wing of Carollia perspicillata, Henningsia resupinata on wood, Penicillium guaibinense from soil, Periconia caespitosa from leaf litter, Pseudocercospora styracina on Styrax sp., Simplicillium filiforme as endophyte from Citrullus lanatus, Thozetella pindobacuensis on leaf litter, Xenosonderhenia coussapoae on Coussapoa floccosa. Canary Islands (Spain), Orbilia amarilla on Euphorbia canariensis, Cape Verde Islands, Xylodon jacobaeus on Eucalyptus camaldulensis. Chile, Colletotrichum arboricola on Fuchsia magellanica. Costa Rica, Lasiosphaeria miniovina on tree branch. Ecuador, Ganoderma chocoense on tree trunk. France, Neofitzroyomyces nerii (incl. Neofitzroyomyces gen. nov.) on Nerium oleander. Ghana, Castanediella tereticornis on Eucalyptus tereticornis, Falcocladium africanum on Eucalyptus brassiana, Rachicladosporium corymbiae on Corymbia citriodora. Hungary, Entoloma silvae-frondosae in Carpinus betulus-Pinus sylvestris mixed forest. Iran, Pseudopyricularia persiana on Cyperus sp. Italy, lnocybe roseascens on soil in mixed forest. Laos, Ophiocordyceps houaynhangensis on Coleoptera larva. Malaysia, Monilochaetes melastomae on Melastoma sp. Mexico, Absidia terrestris from soil. Netherlands, Acaulium pannemaniae, Conioscypha boutwelliae, Fusicolla septimanifiniscientiae, Gibellulopsis simonii, Lasionectria hilhorstii, Lectera nordwiniana, Leptodiscella rintelii, Parasarocladium debruynii and Sarocladium dejongiae (incl. Sarocladiaceae fam. nov.) from soil. New Zealand, Gnomoniopsis rosae on Rosa sp. and Neodevriesia metrosideri on Metrosideros sp. Puerto Rico, Neodevriesia coccolobae on Coccoloba uvifera, Neodevriesia tabebuiae and Alfaria tabebuiae on Tabebuia chrysantha. Russia, Amanita paludosa on bogged soil in mixed deciduous forest, Entoloma tiliae in forest of Tilia x europaea, Kwoniella endophytica on Pyrus communis. South Africa, Coniella diospyri on Diospyros mespiliformis, Neomelanconiella combreti (incl. Neomelanconiellaceae fam. nov. and Neomelanconiella gen. nov.) on Combretum sp., Polyphialoseptoria natalensis on unidentified plant host, Pseudorobillarda bolusanthi on Bolusanthus speciosus, Thelonectria pelargonii on Pelargonium sp. Spain, Vermiculariopsiella lauracearum and Anungitopsis lauri on Laurus novocanariensis, Geosmithia xerotolerans from a darkened wall of a house, Pseudopenidiella gallaica on leaf litter. Thailand, Corynespora thailandica on wood, Lareunionomyces loeiensis on leaf litter, Neocochlearomyces chromolaenae (incl. Neocochlearomyces gen. nov.) on Chromolaena odorata, Neomyrmecridium septatum (incl. Neomyrmecridium gen. nov.), Pararamichloridium caricicola on Carex sp., Xenodactylaria thailandica (incl. Xenodactylariaceae fam. nov. and Xenodactylaria gen. nov.), Neomyrmecridium asiaticum and Cymostachys thailandica from unidentified vine. USA, Carolinigaster bonitoi (incl. Carolinigaster gen. nov.) from soil, Penicillium fortuitum from house dust, Phaeotheca shathenatiana (incl. Phaeothecaceae fam. nov.) from twig and cone litter, Pythium wohlseniorum from stream water, Superstratomyces tardicrescens from human eye, Talaromyces iowaense from office air. Vietnam, Fistulinella olivaceoalba on soil. Morphological and culture characteristics along with DNA barcodes are provided.","{""author_keywords"": ""ITS nrDNA barcodes; LSU; new taxa; systematics"", ""affiliations"": ""0-Institution non d\u00e9sign\u00e9e ; ARC (Agricultural Research Council), South Africa ; Associazione Micologica Bresadola, Italy ; Australia, New South Wales Government: Department of Primary Industries and Regional Development, Australia ; BIOTEC (National Center for Genetic Engineering and Biotechnology), Thailand ; Biotechnology and Ecology Institute, Laos ; CAB International, England ; CAS (Chinese Academy of Sciences), Peoples R China ; CNR (Consiglio Nazionale delle Ricerche), Italy ; CSIC (Consejo Superior de Investigaciones Cientificas), Spain ; Canada. Agriculture and Agri-Food Canada, Canada ; Chile. Servicio Agricola y Ganadero, Chile ; Chile: Servicio Agricola y Ganadero, Chile ; EMSL Analyt Inc, USA ; Eotvos Lorand Univ, Hungary ; Field Museum, USA ; Florida Museum of Natural History, USA ; Franklin & Marshall College, USA ; Harvard Univ, USA ; INIAP (Instituto Nacional de Investigaciones Agropecuarias), Ecuador ; Instituto Politecnico Nacional, Mexico ; Joint Russian-Vietnamese Tropical Research and Technological Center, Vietnam ; Lomonosov Moscow State Univ, Russia ; Mycosynthetix Inc, USA ; NINA (Norwegian Institute for Nature Research), Norway ; Naturalis Biodiversity Center, Netherlands ; New Zealand. Ministry for Primary Industries, New Zealand ; Pontificia Univ Catolica Ecuador, Ecuador ; RAS (Russian Academy of Sciences), Russia ; Reconcavo Bahia Fed Univ, Brazil ; Rio De Janeiro Fed Univ, Brazil ; Royal Botanic Gardens, Australia ; Societa Veneziana di Micologia, Italy ; St Petersburg State Forestry Univ, Russia ; USDA-ARS (Agricultural Research Service), USA ; Univ Antofagasta, Chile ; Univ Estadual Feira de Santana, Brazil ; Univ Fed Bahia Salvador, Brazil ; Univ Fed Lavras, Brazil ; Univ Fed Pernambuco, Brazil ; Univ Fed Rio Grande do Norte, Brazil ; Univ Fed Vicosa, Brazil ; Univ Free State, South Africa ; Univ Illinois, USA ; Univ Mayor, Chile ; Univ North Carolina, USA ; Univ Oslo, Norway ; Univ Ottawa, Canada ; Univ Palermo, Italy ; Univ Pretoria, South Africa ; Univ Tartu, Estonia ; Univ Tehran, Iran ; Univ Valparaiso, Chile ; Univ Vienna, Austria ; Universitat Rovira i Virgili , Spain ; University of Florida, USA ; Uppsala Univ, Sweden ; Westerdijk Fungal Biodiversity Institute, Netherlands ; Yugra State Univ, Russia""}"
clapas_corynespora_6,CLAPAS-corynespora,Fungal Planet description sheets: 716-784,"Fungal Planet description sheets: 716-784 Novel species of fungi described in this study include those from various countries as follows: Australia, Chaetopsina eucalypti on Eucalyptus leaf litter, Colletotrichum cobbittiense from Cordyline stricta x C. australis hybrid, Cyanodermella banksiae on Banksia ericifolia subsp. macrantha, Discosia macrozamiae on Macrozamia miquelii, Elsinoe banksiigena on Banksia marginata, Elsinoe elaeocarpi on Elaeocarpus sp., Elsinoe leucopogonis on Leucopogon sp., Helminthosporium livistonae on Livistona australis, Idriellomyces eucalypti (incl. Idriellomyces gen. nov.) on Eucalyptus obliqua, Lareunionomyces eucalypti on Eucalyptus sp., Myrotheciomyces corymbiae (incl. Myrotheciomyces gen. nov., Myrotheciomycetaceae fam. nov.), Neolauriomyces eucalypti (incl. Neolauriomyces gen. nov., Neolauriomycetaceae fam. nov.) on Eucalyptus sp., Nullicamyces eucalypti (incl. Nullicamyces gen. nov.) on Eucalyptus leaf litter, Oidiodendron eucalypti on Eucalyptus maidenii, Paracladophialophora cyperacearum (incl. Paracladophialophoraceae fam. nov.) and Periconia cyperacearum on leaves of Cyperaceae, Porodiplodia livistonae (incl. Porodiplodia gen. nov., Porodiplodiaceae fam. nov.) on Livistona australis, Sporidesmium melaleucae (incl. Sporidesmiales ord. nov.) on Melaleuca sp., Teratosphaeria sieberi on Eucalyptus sieberi, Thecaphora australiensis in capsules of a variant of Oxalis exilis. Brazil, Aspergillus serratalhadensis from soil, Diaporthe pseudo-inconspicua from Poincianella pyramidalis, Fomitiporella pertenuis on dead wood, Geastrum magnosporum on soil, Marquesius aquaticus (incl. Marquesius gen. nov.) from submerged decaying twig and leaves of unidentified plant, Mastigosporella pigmentata from leaves of Qualea parviflorae, Mucor souzae from soil, Mycocalia aquaphila on decaying wood from tidal detritus, Preussia citrullina as endophyte from leaves of Citrullus lanatus, Queiroziella brasiliensis (incl. Queiroziella gen. nov.) as epiphytic yeast on leaves of Portea leptantha, Quixadomyces cearensis (incl. Quixadomyces gen. nov.) on decaying bark, Xylophallus clavatus on rotten wood. Canada, Didymella cari on Carum carvi and Coriandrum sativum. Chile, Araucasphaeria foliorum (incl. Araucasphaeria gen. nov.) on Araucaria araucana, Aspergillus tumidus from soil, Lomentospora valparaisensis from soil. Colombia, Corynespora pseudocassiicola on Byrsonima sp., Eucalyptostroma eucalyptorum on Eucalyptus pellita, Neometulocladosporiella eucalypti (incl. Neometulocladosporiella gen. nov.) on Eucalyptus grandis x urophylla, Tracylla eucalypti (incl. Tracyllaceae fam. nov., Tracyllalales ord. nov.) on Eucalyptus urophylla. Cyprus, Gyromitra anthracobia (incl. Gyromitra subg. Pseudoverpa) on burned soil. Czech Republic, Lecanicillium restrictum from the surface of the wooden barrel, Lecanicillium testudineum from scales of Trachemys scripta elegans. Ecuador, Entoloma yanacolor and Saproamanita quitensis on soil. France, Lentithecium carbonneanum from submerged decorticated Populus branch. Hungary, Pleuromyces hungaricus (incl. Pleuromyces gen. nov.) from a large Fagus sylvatica log. Iran, Zymoseptoria crescenta on Aegilops triuncialis. Malaysia, Ochroconis musicola on Musa sp. Mexico, Cladosporium michoacanense from soil. New Zealand, Acrodontium metrosideri on Metrosideros excelsa, Polynema podocarpi on Podocarpus totara, Pseudoarthrographis phlogis (incl. Pseudoarthrographis gen. nov.) on Phlox subulata. Nigeria, Coprinopsis afrocinerea on soil. Pakistan, Russula mansehraensis on soil under Pinus roxburghii. Russia, Baorangia alexandri on soil in deciduous forests with Quercus mongolica. South Africa, Didymocyrtis brachylaenae on Brachylaena discolor. Spain, Alfaria dactylis from fruit of Phoenix dactylifera, Dothiora infuscans from a blackened wall, Exophiala nidicola from the nest of an unidentified bird, Matsushimaea monilioides from soil, Terfezia morenoi on soil. United Arab Emirates, Tirmania honrubiae on soil. USA, Arxotrichum wyomingense (incl. Arxotrichum gen. nov.) from soil, Hongkongmyces snookiorum from submerged detritus from a fresh water fen, Leratiomyces tesquorum from soil, Talaromyces tabacinus on leaves of Nicotiana tabacum. Vietnam, Afroboletus vietnamensis on soil in an evergreen tropical forest, Colletotrichum condaoense from Ipomoea pes-caprae. Morphological and culture characteristics along with DNA barcodes are provided.","{""author_keywords"": ""ITS nrDNA barcodes; LSU; new taxa; systematics"", ""affiliations"": ""0-Institution non d\u00e9sign\u00e9e ; Australia, New South Wales Government: Department of Primary Industries and Regional Development, Australia ; Australia, Queensland Government: Department of Agriculture and Fisheries, Australia ; CNR (Consiglio Nazionale delle Ricerche), Italy ; CSIC (Consejo Superior de Investigaciones Cientificas), Spain ; Charles Univ Prague, Czech Republic ; Czech Academy of Sciences, Czech Republic ; EMSL Analyt Inc, USA ; Eotvos Lorand Univ, Hungary ; Hazara Univ, Pakistan ; INIAP (Instituto Nacional de Investigaciones Agropecuarias), Ecuador ; INIFAT (Instituto de Investigaciones Fundamentales en Agricultura Tropical Alejandro de Humboldt), Cuba ; INPA (Instituto Nacional de Pesquisas da Amazonia), Brazil ; Joint Russian-Vietnamese Tropical Research and Technological Center, Vietnam ; Kitasato Univ, Japan ; La Trobe University, Australia ; Lomonosov Moscow State Univ, Russia ; Murdoch University, Australia ; Museum of Natural History in Gorlitz, Germany ; National Museum of Nature and Science, Japan ; New Zealand. Ministry for Primary Industries, New Zealand ; Pontificia Univ Catolica Ecuador, Ecuador ; RAS (Russian Academy of Sciences), Russia ; Royal Botanic Gardens, Australia ; Rudjer Boskovic Institute, Croatia ; Silesian Museum, Czech Republic ; Slovak Academy of Sciences, Slovakia ; St Petersburg State Forestry Univ, Russia ; Szent Istvan Univ, Hungary ; Tula State Lev Tolstoy Pedag Univ, Russia ; USDA-ARS (Agricultural Research Service), USA ; Univ Antofagasta, Chile ; Univ Chile, Chile ; Univ Estadual Feira de Santana, Brazil ; Univ Fed Alagoas, Brazil ; Univ Fed Bahia, Brazil ; Univ Fed Pernambuco, Brazil ; Univ Fed Rio Grande do Norte, Brazil ; Univ Fed Rio Grande do Sul, Brazil ; Univ Fed Vicosa, Brazil ; Univ Gujrat, Pakistan ; Univ Illinois, USA ; Univ Kurdistan, Iran ; Univ Mayor, Chile ; Univ Murcia, Spain ; Univ North Carolina, USA ; Univ Pernambuco, Brazil ; Univ Pretoria, South Africa ; Univ Rovira & Virgili, Spain ; Univ Saskatchewan, Canada ; Univ Southern Queensland, Australia ; Univ Sydney, Australia ; Univ Torino, Italy ; Universite Paul Valery Montpellier 3, France ; Universite de Brest, France ; Universite de Lille, France ; Urmia Univ, Iran ; Veterinarni klinika Fenix, Czech Republic ; Westerdijk Fungal Biodiversity Institute, Netherlands""}"
